{
  "version": "v1",
  "enabled": true,
  "cursor_mode": "hash",
  "outputs": {
    "north_star_catalog": ".cache/index/north_star_catalog.v1.json",
    "assessment": ".cache/index/assessment.v1.json",
    "assessment_cursor": ".cache/index/assessment_cursor.v1.json",
    "scorecard_json": ".cache/reports/benchmark_scorecard.v1.json",
    "scorecard_md": ".cache/reports/benchmark_scorecard.v1.md",
    "gap_register": ".cache/index/gap_register.v1.json",
    "gap_summary_md": ".cache/reports/gap_summary.v1.md"
  },
  "max_controls": 2000
}
